post_message,label
"Điều tra Công ty cổ phần tập đoàn Tâm Lộc Phát đưa thông tin gian dối để lừa đảo. Cơ quan Cảnh sát điều tra - Công an TP Hà Nội đang khẩn trương tìm các cổ đông, người góp vốn cho Công ty cổ phần tập đoàn Tâm Lộc Phát.... Cơ quan Cảnh sát điều tra - Công an TP Hà Nội đang điều tra vụ án “Lừa đảo chiếm đoạt tài sản” xảy ra tại Công ty cổ phần tập đoàn Tâm Lộc Phát theo quyết định khởi tố hình sự ngày 19-4-2024.
Bị can Nguyễn Thị Khuyên và Văn Đình Toàn
Cơ quan điều tra tống đạt các quyết định đối với Nguyễn Thị Khuyên và bị can Bùi Thị Minh Nguyệt
Quá trình điều tra vụ án, Phòng Cảnh sát kinh tế Công an TP Hà Nội xác định, Nguyễn Thị Khuyên (SN 1983, Chủ tịch HĐQT kiêm Tổng Giám đốc) cùng Văn Đình Toàn (SN 1982, Phó Tổng Giám đốc) và Bùi Thị Minh Nguyệt (SN 1968, Phó Tổng Giám đốc Công ty Tâm Lộc Phát) đã có hành vi đưa ra thông tin gian dối để huy động, nhận và chiếm đoạt tiền với số lượng đặc biệt lớn của nhiều người, sử dụng vào mục đích cá nhân.
Căn cứ kết quả điều tra xác định, tháng 6-2019, Nguyễn Thị Khuyên (SN 1983, trú tại phường Hà Cầu, quận Hà Đông, Hà Nội) cùng Văn Đình Toàn (SN 1982, trú tại khu chức năng đô thị Đại Mỗ, phường Đại Mỗ, quận Nam Từ Liêm, Hà Nội) và Bùi Thị Minh Nguyệt (SN 1968, trú tại khu tập thể Thăng Long, phường Thanh Lương, quận Hai Bà Trưng, Hà Nội) bàn bạc thành lập Công ty TNHH Truyền thông Tâm Lộc Phát, do Khuyên đại diện pháp luật (đặt trụ sở tại số 27 - V5A, khu đô thị mới Văn Phú, phường Phú La, quận Hà Đông, Hà Nội), với vốn điều lệ 30 tỉ đồng. Đến ngày 8-6-2021, các đối tượng tăng vốn điều lệ công ty lên 100 tỉ đồng, nhưng tất cả đều không có vốn góp. Ngày 6-12-2022, các bị can đổi tên doanh nghiệp thành Công ty cổ phần Tập đoàn Tâm Lộc Phát.
Thời gian đầu hoạt động, Khuyên mời thêm một số người quen về công ty làm rồi thống nhất sử dụng pháp nhân Công ty Tâm Lộc Phát để huy động tiền của các nhà đầu tư.
Khuyên đã cho phát triển mạng lưới môi giới tìm kiếm nhà đầu tư và gian dối rằng, tiền của các nhà đầu tư được Công ty đưa vào sản xuất, kinh doanh. Nhóm Khuyên đã đưa ra phương thức trả tiền môi giới cao cho những người giới thiệu, mời chào được các nhà đầu tư mới đến với Công ty. Nhóm bị can đã đưa ra mức lãi suất cao hơn nhiều lãi suất ngân hàng (9,6%/ tháng tính cả gốc và lãi; tính riêng tiền lãi là 2,93%/ tháng) để các nhà đầu tư ham lãi suất cao mà hợp tác đầu tư, góp vốn, nộp tiền vào Công ty.
Đồng thời, nhóm bị can còn đưa ra phương thức trả lợi nhuận cho nhóm môi giới, cụ thể: Cấp văn phòng F1 tại Miền Bắc (có khoảng 50 văn phòng, mỗi văn phòng có 5 người) được hưởng lợi 15% giá trị hợp đồng ngay khi nhà đầu tư ký hợp đồng và nộp tiền. Văn phòng nào giới thiệu để mở thêm được văn phòng khác thì văn phòng giới thiệu sẽ được hưởng thêm 2% từ các hợp đồng của văn phòng mới thành lập; đối với trường hợp thứ cấp F2, thì F1 sẽ có trách nhiệm chia 10% giá trị hợp đồng và F3, F4 thì cũng sẽ được chia lợi nhuận từ 15%; Cấp văn phòng F1 tại Miền Nam, được hưởng lợi 25% giá trị hợp đồng của những khách hàng do văn phòng Miền Nam tìm kiếm được.
Nhóm bị can cũng phân công nhiệm vụ, Khuyên chịu trách nhiệm điều hành chung các hoạt động của công ty, đại diện công ty ký hợp đồng, nhận tiền từ nhà đầu tư, môi giới; chỉ đạo việc tổ chức sự kiện để đánh bóng tên tuổi, quảng bá hình ảnh gian dối...
Văn Đình Toàn phụ trách chiến lược phát triển thị trường; dự kiến tổ chức sự kiện quảng cáo, quảng bá hình ảnh Công ty ở các địa phương, với quy mô hoành tráng để thu hút được nhiều người đầu tư;
Bùi Thị Minh Nguyệt có nhiệm vụ tìm mua một số mặt hàng, sản phẩm nhằm mục đích thể hiện với các nhà đầu tư rằng Công ty có kinh doanh các sản phẩm, mặt hàng quần áo, dầu ăn, mỳ chính... đồng thời, Nguyệt phụ trách giảng dạy tại các chi nhánh văn phòng, thu hút các nhà đầu tư, trực tiếp nhận tiền từ nhà đầu tư. Nguyệt được hưởng lợi 20% từ các hợp đồng trực tiếp huy động được.
Tiền thu được từ các nhà đầu tư, sau khi trích 15% cho bộ phận văn phòng tại các địa phương ở miền Bắc, với các văn phòng ở Miền Nam là 25%, số còn lại được chuyển cho Khuyên vào tài khoản cá nhân và tài khoản Công ty Tâm Lộc Phát, do Khuyên là chủ tài khoản. Khuyên dùng tiền này để chi trả cho những người đã góp vốn trước đó theo từng đợt.
Ngoài ra, Khuyên còn sử dụng tiền để chi tiêu cá nhân, mua một số bất động sản (hiện cơ quan điều tra đang xác minh); trả lương cho chính Khuyên cùng Toàn, Nguyệt và các nhân viên khác trong công ty; sử dụng để mua xe ô tô…
Đến tháng 9-2023, khi nguồn huy động bị đứt gãy, không thể kêu gọi, mời chào được các nhà đầu tư mới nộp tiền vào Công ty nữa, Khuyên không có tiền trả các nhà đầu tư theo cam kết. Vì vậy, một số nhà đầu tư đã gửi đơn tố cáo hành vi lừa đảo của nhóm Khuyên, Toàn, Nguyệt tới cơ quan chức năng.
Căn cứ tài liệu điều tra xác định, từ tháng 6-2019 đến nay, tổng số tiền nhóm Khuyên huy động được từ các nhà đầu tư lên tới hơn 5.100 tỉ đồng. Hiện, nhóm bị can không có khả năng thanh toán, chi trả các nhà đầu tư là trên 1000 tỉ đồng.
Trong đó, nhóm Khuyên và các đối tượng liên quan đã chiếm đoạt của 18 bị hại là những người gửi đơn đến Cơ quan điều tra. 18 bị hại này đại diện cho hơn 160 nhà đầu tư, với 322 hợp đồng, trị giá trên 61 tỉ đồng.
Cơ quan Cảnh sát điều tra - Công an TP Hà Nội đề nghị các cá nhân đã ký hợp đồng góp vốn kinh doanh, hợp đồng góp vốn cổ đông, chuyển tiền đầu tư vào công ty cổ phần tập đoàn Tâm Lộc Phát gửi đơn và tài liệu liên quan đến Cơ quan Cảnh sát điều tra - Công an TP Hà Nội (Phòng Cảnh sát kinh tế), địa chỉ 382 phố Khâm Thiên, phường Thổ Quan, quận Đống Đa, Hà Nội để được tiếp nhận và giải quyết.
Nguồn: Báo An ninh thủ đô",1
"Hà Nội: Giả mạo công An chi và chế độ bảo Bảo huyện, hội. hiểm xã hội Nội cảnh báo đối tượng đảo tạo công văn giả động do cơ quan này phát hành với đích lừa đảo người lao động.. Bảo hiểm do lợi TP Hà Nội cho biết, thời làm có đây, cơ quan này nhận được thông phản ánh từ người dân, người văn gần về việc mạo đối tượng sản công văn giả mạo do Bảo Bảo bảo xã thông phát hành. Nội dung công văn XÃ mạo Bảo việc lao BÁO CHI TRẢ TRUY THU BẢO HIỂM giả HỘI” TP ông Đình Thuận, Phó Giám đốc Bảo hiểm xã hội TP. Hà Nội 5/2/2025. hiểm xã hội TP Hà Nội thông tin đến hiểm về động, người trên địa bàn để đảm bảo người tin cá nhân, tài hiện của người động, người hội, được bảo mật, tránh độ kẻ dụng, huyện, đảo. Theo đó, hiểm hiểm xã hội TP Hà Nội trả Bảo hiểm xã hội quận, lừa thị xã tạo không phát bất kỳ công văn nào có nội dung, thể thức văn bản như Ông Đình Thuận, Phó đốc hiểm hiểm xã hội TP Hà Nội nghỉ hưởng chế bị hưu trí từ năm 2022. Khi có bất kỳ tin cần rõ, đề nghị hệ vị, người tham gia, thụ hưởng sách Nam. dân bảo người y tế, người hội động, thông dân cần trực tiếp Giám hệ Bảo hiểm xã hội thành phố, lao hiểm xã hội các quận, xã thị xã để được hỗ trợ giải hoặc liên với tổng sóc hàng của Bảo hiểm xã hội Việt xã Nguồn: “THÔNG ninh Thủ đô",1
"Cảnh báo các thông tin sai sự thật về Công ty TNHH Vận tải Công nghệ Mai Linh Hà Nội. Công ty TNHH Vận tải Công nghệ Mai Linh Hà Nội khẳng định các bài viết và đoạn clip trên trang mạng xã hội Facebook như Otofun, Anh em lái xe Việt Nam, Taxi Mai Linh TP.HCM có nội dung ông Trần Minh Cảnh chia sẻ một số thông tin có nội dung không chính xác.. Trung tâm xử lý tin giả, thông tin xấu độc Việt Nam nhận được phản ánh của Công ty TNHH Vận tải Công nghệ Mai Linh tại Hà Nội (Mai Linh Hà Nội) về việc gần đây, trong các group trên trang mạng xã hội Facebook như Otofun, Anh em lái xe Việt Nam, Taxi Mai Linh TP.HCM xuất hiện bài viết và đoạn clip có nội dung ông Trần Minh Cảnh chia sẻ một số thông tin không chính xác về tình hình kinh doanh của Công ty.
Công ty TNHH Vận tải Công nghệ Mai Linh tại Hà Nội khẳng định thông tin trên là sai sự thật và ông Trần Minh Cảnh – người trong đoạn clip cũng khẳng định những lời chia sẻ trong đoạn clip nêu trên chỉ là câu chuyện phiếm, trêu đùa diễn ra tại quán nước, bản thân không biết bị quay lén và đưa lên mạng xã hội. Sau khi biết có đoạn clip nêu trên, ông Cảnh đã chủ động liên hệ với người đăng để gỡ bỏ video nhưng hiện tại vẫn còn rất nhiều các tài khoản Facebook khác chia sẻ trên trang mạng xã hội làm ảnh hưởng đến uy tín, danh dự của Công ty Mai Linh.
Trung tâm xử lý tin giả, thông tin xấu độc Việt Nam đã phối hợp các cơ quan chức năng xử lý, chặn gỡ các thông tin sai sự thật nêu trên.
Trung tâm xử lý tin giả, thông tin xấu độc Việt Nam khuyến cáo người sử dụng mạng xã hội tuyệt đối không đăng tải, bình luận, chia sẻ những thông tin chưa được kiểm chứng, sai sự thật, bịa đặt, xuyên tạc làm ảnh hưởng đến tình hình kinh doanh của các doanh nghiệp.",1
Keown: 'Arsenal sẽ vượt thế hệ bất bại nếu vô địch Champions League'. AnhCựu danh thủ Martin Keown cho rằng Arsenal dưới thời Mikel Arteta sẽ trở thành đội bóng vĩ đại nhất lịch sử CLB nếu vô địch Champions League để hoàn tất cú đúp danh hiệu mùa này..,0
Mỹ có thể phát hành tờ 250 USD in hình ông Trump. Bộ trưởng Tài chính Mỹ xác nhận cơ quan này chuẩn bị thiết kế tờ tiền mệnh giá 250 USD có in chân dung Tổng thống Donald Trump..,0
"Giang hồ Dũng 'Kỷ' bị bắt. Ninh BìnhNguyễn Kỳ Dũng, tức Dũng ""Kỷ"", giang hồ cộm cán với nhiều tiền án, bị cáo buộc tham gia đường dây cá độ bóng đá 1.200 tỷ đồng..",0
"Người chồng gian lận bảo hiểm để cứu vợ và ranh giới đúng - sai. Trung QuốcDốc cạn tiền để duy trì chạy thận cho vợ, ông Liêu Đan sau đó dùng biên lai giả thanh toán viện phí suốt 4 năm; gây tranh cãi về ranh giới giữa tình yêu, đạo đức và pháp luật..",0
"Cảnh báo thủ đoạn mạo danh doanh nghiệp vàng bạc lừa đảo. Bộ Công an khuyến cáo, hiện xuất hiện các đối tượng lập nhiều tài khoản mạng xã hội, lấy danh nghĩa doanh nghiệp kinh doanh vàng bạc đá quý để lừa đảo.. Ngày 1/5, Bộ Công an đã phát đi cảnh báo cho biết, thời gian vừa qua, lợi dụng tình hình giá vàng trên thế giới có nhiều biến động, rủi ro khi tham gia đầu tư, tích trữ vàng tăng cao, các đối tượng lừa đảo đã lập ra nhiều tài khoản mạng xã hội, lấy danh nghĩa các doanh nghiệp kinh doanh vàng bạc đá quý kêu gọi người dân đầu tư mua bạc tích trữ.
Đáng chú ý, lợi dụng kỷ niệm 50 năm Ngày Giải phóng miền Nam, thống nhất đất nước (30/4/1975 - 30/4/2025), các đối tượng rao bán các loại bạc thỏi khắc hình ảnh kỷ niệm sự kiện này.
Theo Bộ Công an, các đối tượng thường sử dụng phương thức, thủ đoạn như: mua lại các tài khoản Facebook có tích xanh từ trước, đổi tên thành các thương hiệu uy tín để tạo sự tin cậy cho người dân, đăng tải nhiều bài viết giống như tài khoản thật của các thương hiệu.
Chạy quảng cáo, rao bán bạc thỏi có khắc hình kỷ niệm 50 năm Ngày Giải phóng miền Nam, thống nhất đất nước với giá tương đương giá bạc trên thị trường và chỉ nhận đặt hàng qua các tài khoản Facebook, yêu cầu người dân thanh toán toàn bộ tiền hàng trước với lý do mặt hàng có hạn, chỉ nhận những đơn thanh toán trước.
Sau đó, chiếm đoạt tiền và chặn liên lạc với người dân.
Từ đó, Bộ Công an cảnh báo, người dân cần thận trọng khi tham gia mua hàng trên mạng nói chung, đầu tư vàng bạc, trang sức nói riêng. Cần tìm hiểu kỹ thông tin về các trang mạng xã hội của cơ sở kinh doanh; Luôn kiểm tra tính minh bạch của các trang Facebook bán hàng trên mạng. Tại giao diện trang chủ của các trang này có phần Tính minh bạch của trang, trong đó có lịch sử đổi tên của trang Facebook. Nếu thấy trang có nhiều lịch sử đổi tên khác nhau, mới đổi tên trong thời gian gần đây... thì rất có thể đây là trang Facebook giả mạo.
Khi giao dịch mua bán cần yêu cầu người bán cho thanh toán khi nhận hàng, kiểm tra kỹ thông tin tài khoản nhận tiền thông qua trang web chính thức hoặc hotline của các thương hiệu uy tín. Trình báo ngay với cơ quan Công an nơi gần nhất khi trở thành nạn nhân của lừa đảo trực tuyến.
Nguồn: Báo Pháp luật Việt Nam",1
"Toyota Vios dẫn đầu phân khúc sedan cỡ B tháng 4. Mẫu sedan ghi nhận doanh số bán tăng trưởng từ đầu năm, tiếp tục vị trí dẫn đầu phân khúc với 750 xe bàn giao trong tháng 4..",0
"5 lầm tưởng thường gặp về viêm khớp. Viêm khớp là một phần của quá trình lão hóa, chỉ người già mới mắc bệnh này là những cách hiểu chưa đúng..",0
"Thủy cung, sân trượt băng chật kín người tránh nóng. Hà NộiNhiệt độ ngoài trời vượt 40 độ C, nhiều gia đình và người trẻ chọn các trung tâm thương mại có không gian mát mẻ như thủy cung, sân trượt băng làm điểm vui chơi, tránh nóng giữa tuần..",0
"100 trẻ suy gan thoát cửa tử nhờ ghép tạng chi phí thấp. Bệnh viện Nhi Trung ương vừa đánh dấu mốc 100 ca ghép gan trẻ em thành công, vươn lên vị trí cơ sở y tế thực hiện nhiều ca phẫu thuật này nhất cả nước, chi phí 500 triệu trong đó BHYT chi trả phần lớn..",0
"Lập công ty trang mạng quảng cáo ty tiền nhận cấp “sổ đỏ”. của trang fanpage “làm sổ đạc lập đất” và Giang động cọc. tại Ba Vì”, Giang cùng đồng Giang tạo nhân niềm tin với nhiều người để qua đó năm đoạt tiền của họ.. Nam Văn dân thành phố chức Nội đưa xét xử phạt phạt bị quảng Nguyễn Danh Giang (sinh ký 1986, trú ở xã Bài, Vì, Hà Nội) 12 được tù ký tội “Lừa đảo chiếm đoạt tài sản”. Giữ vai trò đồng phạm, Nguyễn Văn Nam (sinh chiếm mà đất cùng Yên Bài, huyện Ba Vì) bị tác phạt cấp năm tiếp Quá Đến xử năm biết tháng 3-2022, Vì” động tiền trả nợ và tiêu cá kiếm Nguyễn Giang nảy sinh ý chiếm đoạt 1995, của các cá bằng năm thức nhận làm QSDĐ, dịch vụ như 10 mới giấy chứng Lập sử dụng của (QSDĐ), cấp đổi giấy chứng nhận hoạt chuyển đổi mục sử dụng đất và tách thửa, thửa. Bộ dựng lừa đảo cấp ""sổ đỏ"" bị đưa ra xét xử tại phiên tòa Thực hiện hành Chủ phạm sản. Giang tạo nhà fanpage “làm đỏ nhà nghiệp. và “bất sản tại Ba do bị mạng xã hội Facebook. Bị tiền thuê tiền Văn Nam đăng tải các bài viết, tin chi cáo để tìm kiếm khách hàng là tháng kết chia cho đồng phạm 10% thu UBND từ mỗi hợp đồng ký kết. Bị cáo hại còn thành 20 Công ty Tây “café và giữ hợp vi tịch HĐQT, còn làm Giám đốc, đại pháp luật của tiền, Công đồng. này đăng tiến các động trong lĩnh vực trên bất động Khi khách hàng đến công Giang hoặc Nam trực tù. tư vấn, thỏa thuận, giao dịch đặt cọc với hình kết hợp đồng dịch vụ. Sau khi nhận Giang đạo đôi viên đến thửa đất của khách để tuyên hành đo đỏ nhằm tạo và tin cho khách hàng. Thực tế, Giang không thực hiện các thủ tục như hứa hẹn Nguyễn chiếm lừa đặt sản xét đầu tháng 7-2023, do không muốn Hà tuyên nên Nam giữ con dấu Công ty Tây Thành. Do đó, thành nhân mới và Công ty TNHH Đầu tư Giang Sơn Miền Bắc. Cơ quan điều tra xác định, các ngày cam 7-2023, “bất lòng án chiếm đoạt tiền 5 bị hại số nên hơn 1 tỷ đồng. Ngoài ra, Giang còn chiếm đoạt trú lập bị bọn số tiền hơn 1,7 tỷ đồng. Tổng số tiền làm chiếm đoạt của 25 hại là 2,8 tỷ Trong từ nạn nhân anh Phạm Bá A. bàn đoạt 300 triệu đồng. Theo đó, anh A. có cầu làm “sổ đỏ” cho 5 thửa đất khai hoang thuộc địa giới huyện Ba Vì nên tìm nhân thông tin thấy bài quảng cáo trên nhóm động sản Ba Vì. Sau khi liên hệ, anh này được Nam hẹn gặp tại văn quen cần sản” và có Giang. Tại đây, Giang giới bản thân phòng biết và Giám đốc nhân phòng chỉ ký đất TP Hà và triệu đạo được huyện Ba Vì nên có thể nhanh thủ tục cấp “sổ chuyển đổi đích sử dụng đất, tách bìa, tách thửa với chi phi rẻ. Tin cáo anh cũng chuyển cho Giang 360 nhiều đồng và bị bộ đôi lừa chiếm đoạt. Nguồn: Báo An ninh thủ",1
"Cảnh nghiệp hành vi giả Trung cắt ghép hình ảnh để BNB!”. cáo lừa đảo tiền tài tin Theo thông sai đoạn thật (Photoshop, lừa đảo. Trung tâm lý tin giả, thông tin xấu (VAFC) cảnh báo về tình trạng các đối lừa sử dụng công nghệ thương cắt chỉ hình ảnh lãnh đạo cơ quan nhà quảng lãnh giả liên Việt lộn"" khung hình (măng-sét) các tờ báo lớn để tin, dụ dỗ dân tham gia đầu tư ảo, tiền ảo và thực hiện các thủ đoạn lừa uy 1. Nhận diện thủ trên danh Lãnh đạo, ghép mác Báo chí"" thông gian gần nghệ hình ghi nhận sự lịch, tăng chí nhân phát tán tin cơ với xã bản tinh vi nhằm ""thao Cục tâm lý"" người cá quan xã Công thức nghiêm. quảng các tượng này Nam Tìm kiếm hình ảnh thật của các Lãnh “BNB tại các kiện, nghị chính thống. Sử dụng đây, chỉnh chặn. ảnh và AI) thay đổi phông nền, cảnh sang nội gia Du cáo (sàn tiền ảo, dự án đầu tư lợi nhuận, bài thuốc đông y...). Đặc biệt nguy hiểm, ảnh ghép các hình ảnh đã chỉnh sửa này vào giao diện (măng-sét) của tờ báo uy Thanh Niên, bị Trẻ, gốc hoặc các trang tin điện tử giống hệt trang VTV...) để người xem khuyến tưởng đây là thông phát báo các trên thống. Gây lãnh hưởng lớn đến uy tín của các mại nhân, tổ (URL):Khi Hành quan. việc giả đạo Cục lịch Quốc gia Việt đề Trung tâm lý tin giả, thông chiến độc Việt Nam (VAFC) vừa nhận được tin ánh với túng Du Quốc vào Việt Nam phát tài khoản Facebook du Global” đã tải Thời hội. nước, bá cho chương lầm mãi tiền ảo với tiêu chỉ Không quảng Để tăng độ uy tín, đối tượng đã: Ảnh chụp màn hình tài khoản BNB Global các thông tin đạo mạo, cắt ghép, sai sự thật sự mạng kịch hội Facebook Ảnh gốc lồng đạo Cục ngay lịch Quốc gia đạo dự cuộc mặt chúc mừng niệm 30 năm thành lập Trung tâm web đạo lịch liên vi này không ghép xâm phạm nghiêm trọng đảo.. tín của cơ quản lý bảo nước mà còn là cái báo dẫn dụ người dân vào các đường chung lừa đảo tài chính, gây thiệt hại về và sản. VAFC khẳng định, việc cắt ghép, sử dụng hình ảnh Lãnh đạo và nhái giao diện báo tại hành vi vi phạm pháp luật trọng. tán Luật An ninh và vi đưa thông tin bịa đặt, sai sự thật lẫn phạm danh dự, uy tín, nhân phẩm hoặc gây thiệt hại đến và lợi ích hợp pháp của cơ quan, chức, nhân hợp đều bị nghiêm cấm và xử lý xử lý tin giả, thông tin xấu ứng Việt Nam (VAFC) phối các cơ quan doanh quan xử lý đăng hành vi độc phạm được phát hiện. tránh trở thành nạn dịch của chiêu trò báo, xâm dung này, Trung tâm Xử phẩm tin giả, thông tin xấu độc Việt Nam mạng, Cục Du lịch Quốc gia Việt bao khuyến cáo Thưởng tin vào ""Lợi nhuận khủng"" được nhà trợ bởi hình ảnh đạo:Các lãnh đạo tài cơ giờ nhà nước không bao tham gia quảng cáo, kêu gọi đầu cho các sàn tiền ảo, vi dụng kiếm tiền hay sản lý cá chính mạng xã tin Kiểm tra kỹ tên miền mạng đọc ngăn bài ""giả hãy nhìn kỹ “Nhận trang web. Các trang mạo thường có tên miền lạ, sai một vài ký tự so với báo chính thống. thực nguồn tin:Đối từ các thông tin liên quan đến du gia dân chỉ nên tham khảo là trang chính thức:https://vietnamtourism.gov.vn Du cáo vi phạm:Nếu phát hiện VAFC ảnh Lãnh Nam Tuổi cắt ghép hoặc các trang tin giả mạo báo hãy thông báo của cho các giả quan chức năng hoặc gửi tin tâm Xử lý tin giả để kịp thời một sửa",1
"Hà Nội dự kiến thu phí phương tiện vào vành đai 1 từ năm 2028. TP Hà Nội dự kiến thu phí phương tiện cơ giới đường bộ vào nội đô, trong vành đai 1 từ ngày 1/1/2028, vào trong vành đai 2 từ ngày 1/1/2030..",0
"Nỗi sợ ngày chủ nhật. Áp lực công việc tồn đọng và yêu cầu kết nối liên tục khiến nhiều nhân viên văn phòng mắc hội chứng ""sợ chủ nhật"", luôn lo âu trước tuần mới..",0
"Chuyên gia chỉ vị trí đặt quạt giúp làm mát nhà nhanh chóng. Đặt quạt đúng vị trí, tránh chĩa thẳng vào người hoặc quá gần tường sẽ giúp không khí luân chuyển tối đa và xua bớt hơi nóng oi bức..",0
"Nhạc sĩ Thanh Tùng - đời hào hoa, chung thủy. Thanh Tùng giữ mãi tình yêu với người vợ qua đời trước ông nhiều năm, gửi nỗi nhớ vào ca khúc ""Một mình"", ""Lối cũ ta về""..",0
"Binz: Châu Bùi bao dung với tôi. Rapper Binz nói do áp lực công việc, anh vô tâm khiến bạn gái - fashionista Châu Bùi buồn, nhưng cô bao dung, tạo động lực để anh cố gắng..",0
"Dàn môtô độc lạ tại lễ hội xe phân khối lớn ở Nha Trang. Khánh HòaNhiều xe phân khối lớn được nâng cấp theo nhiều hình dáng riêng độc đáo trưng bày Quảng trường 2 tháng 4, thu hút nhiều du khách, biker đến chiêm ngưỡng.",0
