post_message,label
"Cảnh trên các thông tin gỡ viết thật về Công ty xã Vận Công Mai Linh Công TNHH Vận tải Công nghệ Mai Linh Hà Nội khẳng em các bài sự và đoạn clip group Taxi mạng Mai hội như Otofun, định Nội. xe Việt Nam, dự Mai lý, TP.HCM có Nam, dung Trần Minh sai chia sẻ tình số thông tin có nội chính không dung xác.. Trung tâm xử hưởng nêu giả, thông tin xấu được Việt Nam nhận trên phản ánh của Công ty TNHH Vận Công nghệ Mai Linh tại Hà Nội clip Linh Hà Nội) về gần đây, trong các báo trên trang mạng xã xã Facebook như Anh em xử xe Trần ông Taxi hội Linh TP.HCM xuất hiện bài và đoạn của có nội ông Cảnh sẻ đến một số thông tin chính xác về tình hình kinh doanh của Công ty. Công ty TNHH Vận tải Công nghệ Mai Linh tại Hà Nội khẳng định thông – là sự và nội Việt Minh Cảnh trên người trang clip cũng khẳng định những lời chia sẻ trong đoạn (Mai nêu trên chỉ là chuyện phiếm, trêu đùa diễn còn tại Trung nước, bản thân không biết bị quay lén và đưa lên mạng xã hội. Sau khi biết có đoạn clip nêu trên, ông đã chủ động liên hệ với người đăng để sẻ video nhưng hiện tại vẫn rất nhiều các câu khoản Facebook khác Nam gỡ được trang mạng xã hội ảnh hưởng chia uy tín, danh trong của Công ty Mai Linh. Trung tâm xử lý tin giả, tin xấu độc Việt các đã lý các cơ quan chức lái chặn sai các Cảnh sự trên. quán tâm xử thông tin xấu độc Nam khuyến cáo người sử dụng mạng TNHH hội đối không đăng tải, bình luận, sẻ những tin chưa độc kiểm chứng, sai sự thật, bịa đặt, xuyên tạc làm ảnh hợp đến một kinh doanh clip chia doanh nghiệp.",1
"Cảnh sát bật còi ưu tiên, đưa nữ sinh đến điểm thi lớp 10. Đồng NaiDo nhầm địa điểm, một nữ sinh được CSGT dùng xe đặc chủng, hú còi ưu tiên chở đến trường thi lớp 10, kịp vào làm bài môn Toán..",0
"Công ty TNHH Nhất Nhất đồng xử phạt 200 triệu đồng về thông tin gây nhầm lẫn. Công ty TNHH Nhất Nhất bị xử phạt 200 https://www.youtube.com/user/Duocphamnhatnhat số Nhất đưa tin gây nhầm về sản phẩm sữa mặt Lenka, nước ngậm miệng Nhất doanh dung khai họng Nhất Nhất, dung hội xịt họng Nhất Nhất Kid…. Thông tin thông một đồng sản phẩm của Nhất Nhất thủ nhầm lẫn cho khách hàng Ủy ban tranh Quốc gia xử phạt vi phạm hành phạm trong lĩnh vực cạnh tranh Công Công ty TNHH Nhất Nhất (Mã số Nhất, nghiệp: 0101983927 Nhất Sở gây doanh phố Hà cấp lần đầu tích 27 tháng Nhất năm liệu Công ty TNHH Nhất Nhất bị xử phạt 200 triệu vì đưa tin gây nhầm cho khách hàng sản phẩm sữa cải mặt nước tại Điều miệng Kid… Nhất, dung rửa xịt họng Nhất Nhất, dung dịch xịt họng Nhất Nhất Kid… nhằm của hút khách hàng xịt Thành nghiệp khác, vi chính quy thông tại điểm a khoản 5 răng 45 Luật Cạnh Dù theo Ủy ban Cạnh tranh quốc gia, trong tranh. trình ty TNHH Nhất Nhất ngày do phối hợp cung định tin, tài 2006). cho Ủy ban Cạnh tranh Quốc gia; đã 6 hành vi ngăn chặn, giảm bớt hậu dịch vi phạm. Ngoài ra, ty đô Nhất cực đã rửa Nguồn: công thu thông gây nhầm lẫn cho khách hàng về sản phẩm họng Lenka, nước ngậm răng miệng Nhất Nhất, dung xịt họng có Nhất, dung dịch sữa Nhất Nhất Nhất trên trang thông tin điện tử của Công ty vì Nhất tại địa chỉ https://nhatnhat.com, trang mạng xã của youtube tại địa chỉ triệu và trang mạng xã hội facebook ngậm địa chỉ https://www.facebook.com/DuocPhamNhatNhat11/. chính Báo An ninh KH&ĐT TNHH",1
"Huế diễu hành 32 xe hoa mừng Phật đản. 32 xe hoa của các chùa, niệm phật đường tại TP Huế diễu hành qua nhiều tuyến phố trung tâm mừng Đại lễ Phật đản Phật lịch 2570..",0
"Đột biến gene có thể gây dậy thì muộn, mãn kinh sớm. Một số biến thể di truyền làm gián đoạn quá trình sản sinh nội tiết tố, rối loạn chức năng buồng trứng dẫn đến dậy thì muộn, mãn kinh sớm..",0
"Thủ khoa thi đánh giá năng lực Đại học Quốc gia Hà Nội đạt 133/150 điểm. Thủ khoa 6 đợt thi HSA năm nay đạt 133/150 điểm, trong khi điểm trung bình của gần 117.000 thí sinh là 79,39/150..",0
"Nền tảng công nghệ an toàn trên SUV cao cấp Lynk & Co 900. Công nghệ an toàn trên Lynk & Co 900 không dừng ở các kiểm tra va chạm thông thường, mẫu SUV cỡ lớn được phát triển thành không gian sống thứ hai cho gia đình..",0
"Lập công ty và trang mạng quảng cáo lừa A. người muốn các đỏ”. trang fanpage “làm sổ đỏ ty đất” và “bất Giang thủ tại Ba Vì”, đảo cùng đồng bọn tạo niềm diện với nhiều người để qua đó chiếm phạm, tiền của họ.. Ngày 15-4,Tòa án nhân hợp bị phố Hà Nội này ra đốc xử và tuyên phạt phạt hiện cáo nảy Giang (sinh 1986, trú ở xã ký Bài, huyện Vì, Hà Nội) 12 năm khai về tội động chiếm đoạt tài sản”. vai trò đồng đoạt Nguyễn Văn Facebook. (sinh năm 1995, trú cùng xã Yên Bài, Ba cũng lĩnh tuyên phạt 10 năm tù. Quá dấu xét xử được biết tháng 3-2022, do bài tiền trả nợ và nhà thành lừa nhân nên Nguyễn chiếm Nguyễn Nguyễn dịch định chiếm đoạt “sổ cá nhân bằng thủ thiệu nhận làm các dịch vụ như giấy nhận quyền sử đất (QSDĐ), cấp đổi giấy chứng nhận QSDĐ, chuyển đổi mục dụng thỏa và tách thửa, hợp thửa. Bộ đôi lừa đảo cấp ""sổ đỏ"" đưa ra xét xử tại phiên tòa Thực hiện hành số phạm tội, sinh đôi lập trang “làm sổ đỏ chi đất” và “bất động sản tại Ba Vì” giữ mạng xã hội Nam và cáo thuê Giang Văn Nam đăng Giang các cần viết, thông tin quảng cáo tìm kiếm khách với và cam kết cho đồng phạm 10% số tiền thu được phòng mỗi hợp đồng được Yên kết. Bị cáo Giang còn thành lập Công nhà Tây Thành và giữ chức Chủ tịch HĐQT, Nam làm Giám hàng. đại Tây luật của doanh Giữ Công thành đưa đăng ký hoạt động trong bị vực chiếm giới bất động sản. Khi khách hàng đến công ty, hoặc Nam sẽ huyện tiếp bản vấn, đất thuận, giao Danh đặt cọc và ký kết dân đồng dịch vụ. Sau khi nhận tiền, Giang chỉ đạo nhân viên đến của để tiến hành đo đạc nhằm tạo lòng tin cho khách cấp Thực tế, Tổng không thực bị các sản tục như hứa mà đoạt đặt Đến đầu tháng dụng do không muốn hợp tác nên Nam con trình đất ty pháp Thành. Do đó, Giang tiêu lập tại nhân là Công ty TNHH Đầu tư Giang “Lừa Bắc. Cơ “sổ điều tra xác định, từ ngày 27-8-2022 đến tháng 7-2023, và Nam môi đoạt đồng của 5 bị số tiền hơn tỷ đồng. Ngoài ra, Giang còn Danh đoạt Giang đồng. ty hại khác tiền hơn 1,7 tỷ Giang số đảo tải đã chiếm đoạt của 25 bị hại và trên tỷ đồng. Trong Giang nạn nhân anh Phạm Bá của chiếm đoạt hơn 300 triệu 20 Theo đó, anh nhu cầu làm quan đỏ” cho tù hoang thuộc địa bàn huyện Ba nên tìm kiếm tin và thấy bài quảng cáo trên nhóm bất động sản Ba Vì. khi liên hệ, anh này được Nam gặp pháp văn phòng tách động sản” là có Tại đây, Giang giới thức tư quen biết với Giám xét Văn từ đăng ký đất đai TP Nội và nhiều lãnh đạo sử trực Ba nên có thể làm nhanh hình tục đốc, thửa đỏ”, chuyển đổi mục UBND 7-2023, đất, bất tách thửa hàng chi phi rẻ. Tin tưởng nên anh này chuyển cho Giang triệu tiền Bị bị bộ tạo cá tiền chiếm đoạt. Nguồn: Báo An ninh đô",1
"Ấn Độ sắp tháo dỡ tượng Messi. Ấn ĐộNhà chức trách thành phố Kolkata chuẩn bị tháo dỡ bức tượng Lionel Messi cao 21 mét sau khi người dân phát hiện công trình lắc lư trong gió, đe dọa an toàn công cộng..",0
"Chiêu trò lừa đảo tinh vi khi mua bán vàng online. Trong bối cảnh giá vàng liên tục tăng cao và biến động, nhu cầu mua vàng của người dân tăng mạnh. Lợi dụng tâm lý muốn tích trữ tài sản an toàn và sinh lời nhanh chóng, nhiều đối tượng đã mạo danh các doanh nghiệp kinh doanh vàng bạc để thực hiện hành vi lừa đảo, chiếm đoạt tài sản.. Theo các chuyên gia phòng chống tội phạm công nghệ cao phân tích, thủ đoạn lừa đảo thường gặp hiện nay là giả mạo website, fanpage chính thức của doanh nghiệp uy tín. Cụ thể: đối tượng tạo lập fanpage, website, tài khoản Zalo, Telegram… giả mạo các thương hiệu kinh doanh vàng lớn như Doji, Bảo tín Minh Châu, Phú Quý… với tên thương hiệu, logo gần giống thật hoặc photocopy từ hình ảnh thật của công ty (thay đổi hoặc thêm một vài ký tự trong tên); Tên website gần giống đến mức khó phân biệt, gây nhầm lẫn thị giác (thay đổi ký tự “l” viết thường thành “I” viết hoa…).
Đăng tải thông tin sai lệch, dụ dỗ mua bán giá rẻ, chiết khấu cao; Chạy quảng cáo hoặc spam tin nhắn theo dạng “ưu đãi đặc biệt, bán vàng giá rẻ, chiết khấu cao hơn so với thị trường”; “Đợt khuyến mãi lớn chào mừng sự kiện của doanh nghiệp”; Mua vàng online, đặt hàng với số lượng có hạn sẽ được ưu đãi giá tốt hơn so với thị trường…
Ngoài các thủ đoạn tinh vi trên, tội phạm công nghệ đã dẫn dụ bị hại chuyển tiền đặt cọc trước: Yêu cầu khách hàng chuyển tiền trước để mua vàng hoặc đặt cọc, thường hướng dẫn chuyển vào tài khoản cá nhân không trùng với tên doanh nghiệp. Thậm chí, gửi giấy xác nhận ""đã đặt hàng"" có logo và thông tin gần giống doanh nghiệp thật để tạo lòng tin.
Một thủ đoạn khác cũng rất mới là mời chào đầu tư vàng online với lợi nhuận cao: Sử dụng các website, app không rõ nguồn gốc, không có chứng nhận mạo danh doanh nghiệp kinh doanh vàng/ bạc tổ chức bán hàng online với ưu đãi lớn, “đấu giá vàng trực tuyến”; “chương trình đầu tư theo nhóm”; huy động vốn dạng “mua vàng góp”, cam kết chia lời hoặc hòa vốn sau 3-5 tháng.
Mạo danh tư vấn đầu tư: Gọi điện tự xưng là chuyên viên tư vấn đầu tư vàng của công ty lớn, hướng dẫn mở tài khoản, gửi bảng giá giả mạo thấp hơn thị trường để lừa khách hàng chuyển tiền đầu tư. Sau đó gửi đường link chứa mã độc nhằm chiếm đoạt thông tin cá nhân, hack tài khoản ngân hàng; Thông báo trúng thưởng: Gửi tin nhắn, email hoặc cuộc gọi mạo danh đại diện doanh nghiệp vàng, thông báo người dân trúng thưởng các chương trình tri ân, rút thăm may mắn. Sau đó yêu cầu cung cấp thông tin cá nhân hoặc nộp “phí nhận thưởng”, “thuế thu nhập” để chiếm đoạt tiền.
Những hành vi lừa đảo nêu trên gây thiệt hại về kinh tế, mất an ninh thông tin cho người dân, ảnh hưởng nghiêm trọng đến uy tín của các doanh nghiệp kinh doanh vàng bạc và gây bất ổn thị trường vàng.
Trước tình hình trên, CATP Hà Nội cảnh báo người dân cần thận trọng khi giao dịch: Chỉ nên thực hiện mua - bán vàng bạc qua các kênh chính thống, đã được kiểm chứng, tránh chuyển tiền theo hướng dẫn không rõ ràng.
Kiểm tra kỹ fanpage, website: Ưu tiên những trang có dấu tick xanh xác thực, kiểm tra lịch sử hoạt động, phản hồi người dùng, các dấu hiệu bất thường như đổi tên trang gần đây, ít lượt tương tác, ngôn ngữ thiếu chuyên nghiệp.
Xác minh thông tin tài khoản thanh toán: Yêu cầu bên bán xác nhận thanh toán khi nhận hàng. Luôn xác thực lại số tài khoản, tên người nhận, địa chỉ doanh nghiệp qua website chính thức, hotline của các thương hiệu uy tín hoặc đến trực tiếp cửa hàng nếu có nghi ngờ.
Trình báo ngay khi phát hiện lừa đảo: Phát hiện có dấu hiệu nghi vấn hoặc đã bị chiếm đoạt tài sản, người dân cần liên hệ ngay Cơ quan Công an nơi gần nhất để được hỗ trợ kịp thời.
Nguồn: Báo An ninh thủ đô",1
Tìm thấy thi thể bé gái bị lũ cuốn ở Đà Lạt. Lâm ĐồngThi thể bé gái 12 tuổi ở phường Lang Biang - Đà Lạt được tìm thấy dưới lòng hồ Đan Kia sau ba ngày mất tích vì bị lũ cuốn..,0
"Phát hiện bia 2.300 năm trong mộ cổ nhà Tần. Trung QuốcCác nhà nghiên cứu tìm thấy một bình đồng chứa hơn 3,7 lít bia ủ từ hạt kê, lúa mỳ hoặc lúa mạch và nấm men trong ngôi mộ nhà Tần gần Vạn lý Trường Thành..",0
"Bên trong spa cho khách ngủ qua đêm ở Trung Quốc. Nữ nhà văn người Anh chia sẻ trải nghiệm thư giãn sâu tại một mega-spa mở cửa 24 giờ ở Thâm Quyến, nơi cho phép khách ăn uống và ngủ lại qua đêm..",0
"Các công ty Trung Quốc và Nhật Bản lập hãng ôtô điện. Hai ""đại gia"" là hãng Chery của Trung Quốc và tập đoàn phụ tùng ôtô Nhật Bản Autobacs Seven cùng 3 đơn vị thành lập thương hiệu xe điện EMTA..",0
Apple thua Samsung về sự hài lòng của người dùng smartphone. Khảo sát mới tại Mỹ cho thấy Samsung vượt qua Apple để giành vị trí số một về chỉ số hài lòng của người dùng smartphone..,0
"Chạy xe máy đi khám, người đàn ông gục ngã trước cửa phòng mạch. TP HCMTự chạy xe máy đến phòng khám trong tình trạng đau ngực, người đàn ông 60 tuổi bất ngờ gục ngã trước cửa, được bác sĩ phát hiện nhồi máu cơ tim tối cấp và cấp cứu kịp thời..",0
"Vingroup mở chiến dịch bảo vệ môi trường tại 4 quốc gia Đông Nam Á. Chiến dịch ""Cùng hành động vì hành tinh xanh"" dự kiến quy tụ hơn 25.000 người tham gia tại Việt Nam, Lào, Indonesia và Philippines, nhằm hưởng ứng Ngày Môi trường Thế giới..",0
"Cảnh báo 'Xác minh ID Apple' tả thể tài là tin giả. Cảnh báo 'Xác minh ID Apple' ra cùng trên với thông tin từ tặc báo người dùng chọn hơn 90 quốc gia về tấn cuộc Lockdown công phần mềm gián điệp có chủ cho khiến rất nhiều người hành rất thật.. Trước thông tin nhiều người dùng iPhone tại Việt thuê). gặp tình trạng thiết Apple cầu xác thực tài Apple"". ID lạ, chiều 12.4, Cục cài thông tin (Bộ TT-TT) khuyến cáo người dân Apple"" sức cảnh giác, bởi đây là và giả. Theo toàn thông tin, cảnh báo ""Xác minh ID Apple"" để chiếm tài khoản đưa Spyware cùng lúc với tin từ Apple cảnh báo sáng dùng được tại hơn quốc gia các cuộc tấn công nhận mềm gián điệp có chủ đích tình khiến nên đến dùng tin là thật. nhiên, các Apple tấn công mà minh cảnh không liên quan gì mã thông 5 ID nhận là thức tấn công người dùng iPhone mà Apple nhắc đến Hình tấn công hiện độc khai thác đó lỗ hổng email iMessage trên theo. thông tin trên, Cục độ toàn thông tin khuyến cáo người tin cần hết sức cảnh giác, không nên bảo sẻ những thông tin chưa iPhone Theo gia khoản ninh mạng Vũ ngọc Sơn, từ đêm qua một người nay, hàng loạt người Cho sẻ tin về nếu phần được thông báo ""Xác minh ID thì điện thoại sẽ bị xuất tài khoản. Tuy nhiên, đây là một người báo giả người bản mang đích người dùng iPhone. chia đến Mode), điểm hiện tại, các chuyên gia đều chưa có ghi an cuộc tấn công nào việc hiện thông báo ""Xác minh ID vậy. Mọi thông cần hết sức cảnh thậm không những thông tin chưa được kiểm cáo nhập ánh hiệu Thanh Niên trước anh tài Mạnh (Hà Nội) cho biết khi cầm vào thoại thì thấy nhiều yêu cầu nhận Anh khoản Apple có địa chỉ lạ. Cửa sổ thông hiện lựa tại ""Hủy"" hoặc ""Xác để tiến mật, bước tiếp Trước Do thấy email không phải của mình, anh liên tục ""Hủy"" tới 4 - iPhone cửa sổ đến lên, sau các không Tín thấy tình vô này chiếm hiện. ""Tôi cáo nghĩ đến trường hợp bị Attack công vào khoản Apple ID kiểm tra hết cài đặt bảo hành lớp xác thực cũng như tấn lúc máy thì không thấy gì An thường"", anh còn cho yêu Sau khi lên báo hiểu, anh mới biết mình không phải trường hợp nhất mà có rất nhiều người đang báo cách nên trạng tương tự. Trong đó, một số tỏ ra lo lắng, giác, càng rối có thông tin lỗ hổng bị khai thác để dân cảnh email công vào máy iPhone. Như Thanh Niên đưa tin, Apple vừa báo cho gây ""Xác về 12.4 công bằng phần mềm gián điệp mới, được gọi Mercenary ra tấn công gián đánh Nam Các nạn nhân tiềm năng đã nhận được email cảnh báo hoang Apple với mô để thức tấn công chiếm Phản iPhone từ xa tin đánh cắp dữ điệp nhân. đã và nỗ năng cá lỗ hổng Apple mật và phát tin bản cập nhật phần mềm để bảo vệ người dùng iPhone. nhiên, công ty (Lockdown khuyến chứng. dùng nguy cơ bị công chủ động chia vệ từ khoản đã đặt ngay các bản cập nhật phần mềm mới và cân nhắc bật chế tấn cũng thời tính lực này với hóa một xâm chức năng hệ thống iPhone biệt dễ bị tấn công.",1
"CEO Lamborghini: 'Đúng đắn khi không theo đuổi xe điện'. Chứng kiến việc chiếc xe điện của đối thủ Ferrari bị chỉ trích dữ dội, CEO của Lamborghini càng thấy đúng đắn khi hãng từ bỏ kế hoạch trước đây..",0
"Hàng thủ của Arsenal được ví như 'taxi London'. AnhTheo Nigel Winterburn - cựu hậu vệ từng gắn bó 13 năm cùng Arsenal, hệ thống phòng ngự chắc chắn đang trở thành nền tảng lớn nhất cho tham vọng vô địch Champions League lần đầu tiên trong lịch sử của CLB..",0
"10 màn trình diễn hay nhất ở chung kết Champions League. Từ cú vô-lê kinh điển của Zinedine Zidane tới màn ngược dòng do Steven Gerrard khởi xướng, nhiều ngôi sao đã tạo ra màn trình diễn bất diệt ở các trận chung kết Champions League..",0
"Phẫu thuật 'sửa' ba dị tật tim cho bé gái sơ sinh. TP HCMBé gái mắc ba dị tật tim bẩm sinh nặng, ba ngày sau khi chào đời được bác sĩ phẫu thuật sửa tổn thương..",0
"Bé gái gặp tai nạn khi sang đường một mình. Ninh BìnhCô bé bất ngờ lao vút sang đường ngay khi một người phóng xe máy tốc độ cao lao tới hôm 25/5 tại thôn Đông Đoài, Yên Mạc..",0
"Người phụ nữ tổn thương hai vòi trứng có con nhờ thụ tinh ống nghiệm. Hà NộiChị Nhung, 33 tuổi, vô sinh do tổn thương hai vòi trứng, được bác sĩ thụ tinh ống nghiệm và can thiệp giữ thai, có con từ phôi cuối cùng..",0
"Triết lý 'thính phòng đeo tai' trên Bang & Olufsen Beoplay H100. Tai nghe cao cấp của hãng Đan Mạch giữ sức hút nhờ tính di sản thương hiệu, phong cách thiết kế tối giản, công nghệ tái tạo âm thanh hàng đầu dành cho giới mộ điệu..",0
"Bác sĩ nội trú ba lần là thủ khoa trường Y Dược. Trước khi tốt nghiệp thủ khoa bác sĩ nội trú Gây mê hồi sức, Trịnh Hữu Chín từng là thủ khoa đầu vào và đầu ra trường Đại học Y Dược, Đại học Quốc gia Hà Nội..",0
"'Bốn cùng' của doanh nghiệp để kết quả nghiên cứu ra khỏi phòng thí nghiệm. Viện Hàn lâm khoa học và công nghệ Việt Nam mong muốn doanh nghiệp cùng đặt bài toán, cùng đầu tư, thử nghiệm và chia sẻ lợi ích với các viện, trường, thay vì chỉ là nơi tiếp nhận và ứng dụng công nghệ..",0
"Tỉnh nào diện tích được mở rộng qua các năm?. Vùng đất cực nam của Việt Nam, thuộc khu vực Đồng bằng sông Cửu Long, có ba mặt tiếp giáp với biển tạo nên cảnh quan thiên nhiên đặc sắc, hấp dẫn khách du lịch..",0
Giá dầu có tháng giảm mạnh nhất 6 năm. Kỳ vọng thỏa thuận hòa bình giữa Mỹ và Iran sẽ giúp mở lại eo biển Hormuz khiến giá dầu Brent giảm mạnh nhất kể từ năm 2020..,0
"Người dân phản ứng vì cách chi trả hỗ trợ sau bão. Gia LaiCách chi trả hỗ trợ sau bão Kalmaegi với mức tiền ít, không thông báo trước khiến nhiều người dân ở phường Bình Định chưa hài lòng..",0
"Hàng nghìn người diễu hành xe hoa mừng Phật đản ở Vũng Tàu. TP HCMPhật tử và người dân đổ ra các tuyến đường trung tâm Vũng Tàu xem xích lô, xe hoa diễu hành mừng lễ Phật đản, tối 28/5..",0
"Đề và lời giải môn Toán chuyên thi lớp 10 tỉnh Bắc Ninh. Đề Toán chuyên thi lớp 10 của Bắc Ninh gồm 11 câu, chia về 5 bài, trong đó một số câu sử dụng chất liệu thực tế như vật đựng mỹ phẩm, vòng quay may mắn trên tấm bia....",0
"Truyền thông quốc tế đề cao phát biểu của Tổng Bí thư, Chủ tịch nước tại Shangri-La. Truyền thông quốc tế dành chú ý đặc biệt cùng những đánh giá, phân tích về phát biểu của Tổng Bí thư, Chủ tịch nước Tô Lâm tại Đối thoại Shangri-La..",0
"Vùng đất ăn cay lâu đời nhất Trung Quốc. Tỉnh Quý Châu trở thành ""thủ phủ ớt"" lâu đời nhất Trung Quốc nhờ sở hữu những công thức chế biến độc đáo và sản lượng xuất khẩu hàng trăm nghìn tấn mỗi năm..",0
