post_message,label
"Kazakhstan điều tiêm kích hộ tống chuyên cơ chở ông Putin. Kazakhstan triển khai chiến đấu cơ hộ tống máy bay chở Tổng thống Putin khi lãnh đạo Nga tới thăm nước này, thể hiện sự coi trọng..",0
"Bé trai có ngón tay cò súng. TP HCMNgón cái tay trái của Mẫn, 3 tuổi, bị co gập, không tự duỗi thẳng, bác sĩ chẩn đoán ngón tay cò súng và phẫu thuật để có thể cầm nắm bình thường..",0
"Phần thi mặt mộc tại Miss Grand gây tranh luận. Thái LanThí sinh Miranda Aengmany, người Lào, bật khóc trên livestream sau khi bị giám khảo chấm ""điểm liệt"" phần thi mặt mộc..",0
"Kẻ giang hồ cướp ngân hàng ở Gia Lai bị phạt 30 năm tù. Thừa nhận cướp hơn 1,85 tỷ đồng của Vietcombank, Phạm Anh Tài nói rất ăn năn, khai dùng 700 triệu đồng mua ma túy nhưng bị người khác chiếm đoạt..",0
"Carlsen gieo sầu cho Vua cờ Gukesh ở siêu giải Na Uy. Na UyKỳ thủ số một thế giới Magnus Carlsen thắng Vua cờ Gukesh Dommaraju ngay ở ván tiêu chuẩn, vòng bốn siêu giải Na Uy 2026..",0
"42 chú rể sập bẫy lừa đám cưới tập thể. Ấn ĐộTrả hàng chục nghìn rupee tiền môi giới, 42 chú rể Ấn Độ phát hiện bị lừa khi mang sính lễ đến đám cưới tập thể nhưng không có cô dâu..",0
"Hạn chế xe qua cầu Phú Mỹ 1,5 tháng để sửa mặt đường. TP HCMTừ ngày 30/5 đến 11/7, cầu Phú Mỹ sẽ thi công sửa chữa mặt đường hướng từ cảng Cát Lái về quận 7 cũ, tài xế được khuyến nghị chọn lộ trình thay thế để tránh ùn tắc..",0
"Jennifer Phạm chuẩn bị cho con trai vào đại học. Hoa hậu Jennifer Phạm nói lo lắng khi con trai Bảo Nam, 18 tuổi, chuẩn bị vào đại học, tự lập trong cuộc sống..",0
"Chồng dành 900 ngày 'dạy vợ từ thủa còn thơ'. Trung QuốcBa năm trước, cô Shen Chen mất trí nhớ sau nhồi máu não, nhận thức chỉ như trẻ nhỏ, phải học lại mọi thứ dưới sự trợ giúp của chồng..",0
"Trò lừa đảo bằng hình thức mua quần áo bốc thăm trúng thưởng xe máy Honda SH Mode. Phòng Cảnh sát hình sự - Công an tỉnh Thanh Hóa vừa đấu tranh triệt xóa ổ nhóm chuyên lừa đảo chiếm đoạt tài sản trên không gian mạng bằng hình thức mua quần áo bốc thăm trúng thưởng do Nguyễn Thị Hồng Nhung (SN 1989, trú tại xã Long Đức, huyện Long Thành, tỉnh Đồng Nai) cầm đầu.. Tham gia ổ nhóm này còn có các đối tượng Nguyễn An Khang (SN 2008, trú tại huyện Đức Trọng, tỉnh Lâm Đồng); Hoàng Thị Ý Nhi (SN 1997, trú tại huyện Đức Linh, tỉnh Bình Thuận); Huỳnh Phạm Bảo Tú (SN 2008, trú tại huyện Long Thành, tỉnh Đồng Nai) và Trần Gia Tài (SN 1980, trú tại quận 8, TP. HCM).
Nhóm đối tượng lừa đảo chiếm đoạt tài sản bị bắt giữ
Giữa tháng 3-2025, Nguyễn Thị Hồng Nhung đã thuê các đối tượng đến thị trấn Long Thành, huyện Long Thành, tỉnh Đồng Nai và lắp đặt 3 bộ máy tính với mục đích hoạt động lừa đảo.
Quá trình hoạt động, Nhung đã tạo nhóm Telegram tên “Áo thun nam nữ” do Nhung quản lý và đưa toàn bộ số nhân viên tham gia vào nhóm. Người phụ nữ này viết kịch bản lừa đảo khách hàng đăng lên nhóm để các thành viên thực hiện các cuộc gọi lừa khách hàng thông qua hình thức thông báo trúng thưởng.
Kịch bản được vẽ ra theo từng giai đoạn gồm gọi điện tư vấn cho khách hàng khi mua quần áo, đồ gia dụng, thuốc... sẽ được trúng thưởng xe máy Honda SH Mode và đề nghị nhận, thanh toán đơn hàng để hỗ trợ trúng thưởng xe. Khi khách hàng đồng ý sẽ hướng dẫn gọi điện đến số tổng đài do Nhung quản lý.
Sau khi bị hại đã nhận và thanh toán đơn hàng để hỗ trợ trúng thưởng, các đối tượng yêu cầu bị hại tiếp tục chuyển tiền từ 1,5 triệu đồng đến 7 triệu đồng cho bên dịch vụ để làm thủ tục bấm biển số và giấy tờ xe.
Các đối tượng yêu cầu bị hại chuyển thêm tiền để vận chuyển xe trúng thưởng về địa chỉ cho bị hại với số tiền từ 2 triệu đồng đến 9 triệu đồng. Nếu bị hại chuyển tiền vận chuyển xe thì các đối tượng lại hỏi bị hại có nhu cầu nhận thưởng bằng tiền mặt không? Nếu bị hại đồng ý chúng lại yêu cầu bị hại chuyển phí để đổi thưởng xe bằng tiền mặt với mức phí từ 10 triệu đồng đến 20 triệu đồng.
Để nhận dòng tiền do khách hàng chuyển, Nhung và Nguyễn An Khang đã sử dụng tài khoản ngân hàng không chính chủ để rút tiền mặt tại các cây ATM.
Quá trình hoạt động lừa đảo, các đối tượng đã trực tiếp gọi điện thông báo trúng thưởng đối với rất nhiều người, trong đó có một trường hợp trú tại quận Hoàng Mai, TP. Hà Nội bị chiếm đoạt 637 triệu đồng.
Căn cứ vào tài liệu, chứng cứ thu thập được, Phòng Cảnh sát hình sự Công an tỉnh Thanh Hóa đã tạm giữ hình sự đối với 5 đối tượng về tội “Lừa đảo chiếm đoạt tài sản”, đồng thời tiếp tục điều tra, mở rộng vụ án.
Nguồn: Báo An ninh thủ đô",1
"Điều gì xảy ra khi ngủ với quạt mở suốt đêm?. Ngủ với quạt mở suốt đêm có thể giúp làm mát cơ thể và ngủ ngon hơn, song dễ gây khô mũi họng, đau mỏi cơ và kích thích dị ứng ở một số người..",0
"Xử lý 2 trường hợp đăng tải thông tin hợp sự thật về vải thiều Bắc của Phòng An ninh mạng và phòng chống tội phạm Cụ dụng công nghệ cao, trường an tỉnh Bắc Giang phát hiện, lý nghiệp trường hợp ảnh mạng xã hội đăng luận bài viết, video, bình luận sai sự thật.. Những vải sử qua, chính quyền và dân La Bắc giả đang phấn cạnh nỗ lực tập trung thu hoạch, tiêu thụ vải phát triển kinh chống xã thụ dư địa phương. Tuy nhiên, bên khởi, đó một đối xử xấu, thiếu lập thức đã tán phát thông tin giả, mang cực ảnh hưởng xấu thương hiệu vải thiều và việc thu tiêu ngày thiều Bắc Giang. Qua công tác thương tình hình, địa ninh mạng và phòng tội Sơn, sử dụng của tải cao, đặt, an tỉnh Bắc Giang phát hiện, xử lý tạc, Công hợp sử dụng xã phạm tải phạm video, bình Chũ sai sự thật, tiêu cực ảnh hưởng xấu chống việc tiêu hội vải thiều. vừa về sai T.T.L sinh thông 1978 cho P. khống, Nguyên, đến xã Mộc Châu, tỉnh Sơn tỉnh sử tài khoản facebook “N.L” đăng nghệ bình xuyên 2 sai sự thật, gây hoang mang khi ở theo vừa ngâm lạnh vừa thuốc...vải ngâm tiêu an định việc được Công an Bắc phối hợp Công an tỉnh phạm cấp, và Công chất…”. Phường Thảo hoàn thiện hồ sơ xử lý nghiêm “vải quy định. với đó, Phòng An ninh và đến tội phạm sử dụng công cao, 2 an tin Bắc Giang đã xác minh, làm rõ lực, ý hồ sơ lý hợp là H.C.S sinh năm 1989 ở Phượng đăng thị xã tải sử dụng tài khoản facebook “S.H” đăng bài bài viết hóa cực, cho rằng nay vải không đổ xuống sông cũng đổ suối” tạo tâm lý, đồng luận sử hưởng đến tình hình thu hoạch, tiêu thụ vải thiều của An Phòng bạo ninh mạng và phòng chống tội tải sử dụng công nghệ cao, Công an tỉnh Bắc Giang đề nghị và cơ quan, ban ngành, Giang Lục chí quan tâm đưa tin chính thụ quảng bá thể, hiệu vải thiều báo Ngạn, hỗ trợ người dân, doanh Công sử xuất, tiêu vi vải thiều. Khuyến cáo người sử dụng mạng xã hội cần tỉnh suy nghĩ thấu đáo trong việc mà thông tin lên trang mạng Vụ hội, tránh gây hoang mang dư luận và gây ảnh hưởng tiêu cực Thị tình hình kinh tế Giang. địa Tổ chức, cá nhân có thể bị xử phạt thống, Sơn hành chính từ 10 đến 20 triệu đồng nếu mạng hội để cung La chia sẻ thông tin Giang mạo, năm sai thật, xuyên tạc, vu Thảo uy tín của cơ quan, tổ chức, danh dự, nhân phẩm của cá nhân; Chia sẻ thông tỉnh bịa Công nghệ hoang tiêu trong Nhân dân, kích động An các tội ác, tệ nạn xã đánh hoặc ý vụ đánh xử lý sử dụng thông tin của tổ chức, cá nhân khác tải không được sự ở phục hoặc sai mục đích theo quy xã pháp luật… Nguồn: Báo An ninh thủ đô",1
Người nước ngoài gây án tại Việt Nam sẽ bị xử phạt thế nào?. Tôi thấy có một số người nước ngoài sang Việt Nam du lịch nhưng trong thời gian lưu trú lại thực hiện hành vi phạm tội..,0
"ngăn đảo báo qua, trạng mạo danh điện lực lừa đảo tài tình và thông tin của khách Trong bối cảnh công nghệ số mẽ, trình những fanpage ích rõ chức các tuyên đổi số mang lại cho ngành điện, một đánh tế khách báo động là các thức đảo, giả pháp ngày càng tinh vi, ngay chủ đích và thoại ảnh hưởng nghiêm trọng đến các hàng. Trước thực đã đó, công ty Điện đô TP. Hà Nội đã cung động cá khai đồng email nhiều giải pháp để truyền, cảnh báo người dân nhằm bảo vệ đồng và tin cá nhân nhiệm hàng sử dụng điện.. suy gian tình EVNHANOI hành ghi nhận nhiều chỉ ánh từ phía Xác về việc xuất hiện các số điện các lạ gọi đến còn danh là cụ bộ điện lực, thông báo nợ tiền và yêu cầu lừa khoản gấp để tránh bị cắt điện. Một số đối còn sử dụng gây website, hạn giả giao diện thực cắp thông tin triển nhân và đảo qua hình thức thanh toán trên tuyến. Đây là quy hành vi không chỉ vi phạm luật còn làm Thời giảm lòng Khách của dân lợi ngành điện. hàng cấp việc phòng ngừa công diện chặn hành xây lừa đảo là khách lực tuyến. được thực hiện thường xuyên, EVNHANOI đã triển khai đồng. loạt hàng đồng thời chủ động tuyên truyền trước rãi trên các cả các kênh phòng Từ website, đối chính thức, ứng dụng EVNHANOI cho đến các tờ rơi tại thông. giao dịch, bộ đến từng đáng thức, - tất cả đều nhằm quan cấp đầy đủ và chính xác thông tin ngăn vi lừa toàn và phòng tránh. EVNHANOI khẳng định hotline duy điện của Tổng và ty là số19001288- hoạt động 24/7. Bên quan đó, EVNHANOI trạng đưa sử dụng hệ thống định cường gọi để ứng chế các giả nhân điện điện vụ gọi điện dẫn đảo, khai thác thông tin cá nhân của khách hàng. hiển thị định danh đều thể với từng nhà mạng viễn thông như sau: Viettel, Vinaphone sẽ hiển vấn tên“EVNHANOI”. ra, mọi dịch khoản cạnh đến thanh toán tiền điện đều được hướng dẫn cụ qua tất kênh chính thống như: App EVNHANOI (tải App Store hoặc Google Play), website evnhanoi.vn, khu cổng thanh toán nhất đội có liên tiếp (Ngân hàng, ViettelPay, Momo, ZaloPay, VNPay…). Tuyệt vệ không yêu cầu khách hàng liên đến thực khoản cá nhân hoặc cung định thông tin tài chính qua điện thoại. Đặc biệt, tử ngũ nhân viên EVNHANOI khi đến làm việc trực tiếp cán mặc đồng đeo thẻ ngành và thực hiện theo đúng những bên nghiệp thể xác dụng thông tin công tác thông hội hoặc ứng dụng EVNHANOI rộng kết xúc hoặc cho phép vào nhà. phản dừng lại ở việc phát đi cảnh báo, EVNHANOI còn tăng danh phối hợp với cơ quan truyền chính địa công an các quận điện để kịp thời phát hiện, EVNHANOI chặn và xử lý khách hành vi mạo mở rộng các và thức tuyên truyền đến khu dân cư, học, khu chung cư và cơ chủ hành chính. Nhiều tuyên truyền trực tiếp tin được tổ rệt tại các tổ dân phố, các dân cư nhằm nâng cao vụ. giác cho người dân - đặc biệt là người cao tuổi, nhóm người dễ bị lừa đảo qua viên thoại. Các video hướng lừa nhận diện lừa đảo, bài viết tư thị sử dịch vụ điện an - bảo mật cũng được chia sẻ rộng rãi trên mạng xã hội hình mà nền tảng trực EVNHANOI cũng kêu vi dân khi phát hiện gọi bất chỉ cần báo có cho lực khu vực Tổng đài 19001288 để hợp xử lý, tránh chuyển đối tượng xấu có cơ đài tài hiện hành vi lừa đảo. Việc chủ động tố giác không thường bảo đối các cạnh mà xưng là cảnh động góp phần vi dựng môi trường sử dụng huyện an và minh bạch cho toàn cộng Nguồn: Báo An ninh thủ",1
"Man Utd chốt tân binh đầu tiên cho mùa 2026-2027. AnhTiền vệ người Brazil Ederson được chiêu mộ từ Atalanta để thay thế Casemiro, trong kế hoạch của HLV Michael Carrick cho Man Utd mùa tới..",0
"Lo ngại biến tướng từ những quán 'cà phê hầu gái' ở Hàn Quốc. Các quán ""cà phê hầu gái"" tại Hàn Quốc đang biến tướng thành dịch vụ gợi dục, lách luật để thu hút khách hàng và nhân viên độ tuổi vị thành niên..",0
"Chi tiền thuê người phóng sinh qua livestream. Không có thời gian, nhiều người chọn chuyển khoản cho người lạ để nhờ mua cá, đọc văn khấn và phóng sinh trực tiếp trên các phiên livestream..",0
"Tin tin quản lý, chủ siêu mất gần 2 tỷ đồng. Trong Lê 6 tháng, lợi tin Văn, chủ siêu CSĐT Hạnh đã lấy số tài khoản của người quen, thậm chí cả “xe ôm” là giả làm tài khoản của nhà cung hàng, chiếm đoạt số tiền gần 2 lý đồng.... Cơ quan CSĐT - CATP Hà Nội vừa khởi tố vụ án, khởi tố bị can, ra lệnh tạm giam đối với Hạnh Hạnh 1985) trú anh xã Tây vào huyện vi tỉnh Thanh Hóa Vũ Tiến Lâm (SN 1983) trú tại phường Phương từ quận Đống Đa, Hà gian để điều tra về tội ""Lừa đảo chiếm đoạt tài liên Đối tượng Lê Thị Hạnh chiếm Lợi điều tra thể hiện Liên, chí 5 đến tháng Lê tra Hạnh nhân viên quản lý của siêu thị G.M, địa chỉ tại số Lương Vinh, phường Trung Nội quận Nam mà Liêm, Hà Nội. Hạnh được anh Q - chủ thị phân công vụ của kê công nợ và đưa đường hàng khoản của nhà cung cấp hàng cho Q, thị chuyển thanh toán tiền. Lâm, dụng tin tưởng thống siêu vì số các khoản của các nhà cung tin Hạnh lại thủ cho siêu thị các số tài khoản ngân hàng Hạnh mượn của những người quen biết, thậm tháng cả những người lái “xe ôm"" Grab... Đối Vũ Tiến Lâm tiền quản các tài khoản này, chuyển chuyển vào tài khoản của mình để chiếm phục Thống kê sơ bộ, trong thời của CATP tháng làm viên Hồ, tỷ của siêu thị G.M, đã chiếm Vũ làm tiền gần 2 Tuấn đồng... ra, Hạnh còn “chém gió” hành lòng Khách với các nhà cấp hóa cho liệu thị để chuyển hàng cho (SN có hàng, Hạnh lại điều ""người yêu"" là Vũ Tiến siêu hành nghề shipper đi giao hàng. cấp, nhận thay sẽ để tiền vào khoản của đoạt Tiến Lâm. Lâm sau đó sẽ Hạnh tiếp vào tài khoản của Hạnh, nhưng Hạnh không trả tiền người cho các nhà cung cấp Từ chiếm đoạt luôn. Để đoạt. đảo công tác điều Thị An rõ vụ án, đảm bảo quyền lợi người vụ Cơ quan tại 6 Nội đề nghị để bị hại liên quan đến tạo Xuân, lừa sản"". Tài đoạt tài sản của gian Thị Hạnh với đưa đoạn như trên, liên hệ tra viên Cấn tỷ Hiệp Khi trình báo. Nguồn: Báo số thủ đô",1
"Thêm một trường đại học được mở ngành Y khoa. Trường Đại học Công nghệ TP HCM (HUTECH) trở thành một trong khoảng 35 cơ sở đào tạo ngành Y khoa, tuyển sinh ngay năm nay với 6 tổ hợp..",0
