post_message,label
"Giả mạo các cuộc thi Trạng Nguyên Tiếng Việt để lừa đảo. Trung tâm Xử lý tin giả Việt Nam (VAFC) tiếp nhận công văn khẩn cấp từ Công ty TNHH Đầu tư Giáo dục Trạng Nguyên. Công ty này báo cáo về tình trạng giả mạo các sản phẩm giáo dục nhằm lừa đảo, chiếm đoạt tài sản của phụ huynh và học sinh. VAFC đã ngay lập tức phối hợp với các cơ quan chức năng để xác minh và xử lý.. Thủ đoạn tinh vi và hậu quả nghiêm trọng
Theo báo cáo từ Công ty TNHH Đầu tư Giáo dục Trạng Nguyên, từ đầu năm 2024 đến nay, nhiều đối tượng lừa đảo đã lợi dụng tên và hình ảnh của các sân chơi giáo dục uy tín của Công ty như “Trạng Nguyên Tiếng Việt”, “Trạng Nguyên Toàn Tài” và “Toán Học Việt Nam”, ...  để tạo ra các trang Facebook, fanpage giả mạo. Mục tiêu của chúng là hướng dẫn người dùng tham gia các nhóm Telegram để thực hiện nhiệm vụ, với lời hứa hẹn hưởng hoa hồng. Thậm chí, chúng còn thu phí tham gia và lấy thông tin cá nhân của học sinh để chiếm đoạt tài sản.
Công ty Trạng Nguyên cho biết, họ đã ghi nhận nhiều trường hợp phụ huynh bị chiếm đoạt số tiền lên tới hàng tỷ đồng. Một thủ đoạn đặc biệt nguy hiểm là các trang giả mạo này còn báo cáo vi phạm, khiến trang Facebook chính thức của “Trạng Nguyên Tiếng Việt” bị khóa, làm gián đoạn hoạt động truyền thông và gây khó khăn trong việc cung cấp thông tin chính thống đến cộng đồng.
Khuyến cáo từ VAFC
VAFC khuyến cáo người dân cần hết sức cảnh giác với các chiêu trò lừa đảo tinh vi này. Để bảo vệ bản thân và người thân, chúng tôi đề nghị:
Chỉ tin tưởng vào các kênh thông tin chính thức, đối với các sân chơi trực tuyến của Trạng Nguyên Tiếng Việt, Trạng Nguyên Toàn Tài và Toán Học Việt Nam chỉ diễn ra trên các website chính thức làhttp://trangnguyen.edu.vn,http://tnmath.edu.vnvàhttp://vnmf.edu.vn.
Xác minh thông tin qua các kênh truyền thông chính thức: Trạng Nguyên có các kênh Facebook, Zalo, và Hotline chính thức. Người dùng nên kiểm tra danh sách các trang chính thức được Trạng Nguyên công bố trong công văn và không tương tác với các trang có dấu hiệu giả mạo.
Tuyệt đối không tham gia các hoạt động đáng ngờ: Cảnh giác với các lời mời tham gia nhóm làm nhiệm vụ để nhận hoa hồng, đặc biệt khi yêu cầu nạp tiền, đặc biệt với các nhóm trên Telegram. Đây là thủ đoạn phổ biến của các đối tượng lừa đảo.
Báo cáo khi phát hiện vi phạm: Khi phát hiện các trang, nhóm có dấu hiệu lừa đảo, hãy báo cáo ngay cho cơ quan chức năng để kịp thời xử lý.
VAFC đang tích cực phối hợp với các cơ quan chức năng và đơn vị liên quan để điều tra, xử lý nghiêm các đối tượng mạo danh, tăng cường truyền thông để ngăn chặn, hạn chế tối đa nguy cơ lừa đảo trong tương lai.
Các trang truyền thông chính thức của công ty:
·Facebook:
Trạng Nguyên Education:
https://www.facebook.com/trangnguyen.education/
Trạng Nguyên Tiếng Việt:
https://www.facebook.com/trangnguyentiengviet.vn/
Trạng Nguyên Toàn Tài:
https://www.facebook.com/trangnguyentoantai.vn
Trạng Nguyên Lịch Sử:
https://www.facebook.com/trangnguyenlichsu.vn
Trạng Nguyên Mẫu Giáo:
https://www.facebook.com/trangnguyenmaugiao
Hệ sinh thái TNMath:
https://www.facebook.com/TNMath
Sân chơi Toán học Việt Nam - VNMF:
https://www.facebook.com/vnmf.vn
Zalo OA:Trạng Nguyên Education:
https://zalo.me/1450240811086277576
·Hotline:1900633330
·Website:
http://trangnguyen.edu.vn
http://tnmath.edu.vn
http://vnmf.edu.vn
Danh sách các trang giả mạo được công ty gửi kèm:
Các link giả mạo Trạng Nguyên Tiếng Việt
Các link giả mạo Trạng Nguyên Toàn Tài
Link giả mạo cuộc thi Toán học Việt Nam
https://www.facebook.com/people/S%C3%A2n-ch%C6%A1i-To%C3%A1n-h%E1%BB%8Dc-Vi%E1%BB%87t-Nam-Festival-VNMF-2025-2026/100092350617879/?_rdc=1&_rdr#",1
"Hơn 300 người bị lừa nộp tiền sang Hàn Quốc làm nông nghiệp. Thái Mộng Cầm khoe có khả năng đưa lao động sang Hàn Quốc làm việc theo diện Visa E8-2, lừa nhận hơn 5 tỷ đồng của hàng trăm người.. Thái Mộng Cầm khi bị bắt tạm giam. Ảnh:Công an Cần Thơ
Ngày 30/4, Cầm ở quận Bình Thuỷ (quốc tịch Việt Nam và Hàn Quốc) bị Công an TP Cần Thơ khởi tố, bắt tạm giam để làm rõ hành viLừa đảo chiếm đoạt tài sản, theo điều 74 Bộ luật Hình sự.
Theo điều tra ban đầu, tháng 8/2023 đến 4/2024, Cầm đưa ra thông tin gian dối về điều kiện và khả năng cung cấp dịch vụ đưa người sang Hàn Quốc làm việc theo diện Visa E8-2 (lao động ngắn hạn trong nông nghiệp) để chiếm đoạt tiền của người có nhu cầu.
Nộp tiền nhưng chờ nhiều tháng vẫn không được ra nước ngoài làm việc, nhiều nạn nhân đã tố cáo sự việc với công an.
Bước đầu, cơ quan điều tra xác định bằng thủ đoạn này, Cầm đã lừa hơn 5 tỷ đồng của 349 bị hại, sử dụng cho mục đích cá nhân. Công an Cần Thơ kêu gọi ai là bị hại của Cầm cần sớm liên hệ, cung cấp thông tin phục vụ điều tra.
Nguồn: Báo an ninh thủ đô",1
"Hà các lao đối công văn hiểm TP hội độ “THÔNG hiểm xã Bảo hiểm xã hội Hà Nội cảnh người mạo tượng lừa đảo tạo công văn giả mạo do cơ quan này phát hành tham mục đích lừa đảo người Nội: động.. Bảo hiểm xã hội trí Hà Nội cho biết, thời thông gần đây, cơ quan đã nhận có thông tin phản người dân, báo lao BẢO việc có đối tượng 2022. công hội giả mạo Bảo hiểm xã chế TP phát hành. Nội dung Giả tế, giả hoặc về việc bảo BÁO CHI TRẢ 5/2/2025. THU động HIỂM do ông Đặng Đình Thuận, Phó Giám đốc Bảo hiểm xã hội TP. Hà Nội ký ngày liên Bảo chi xã hội trả Nội gian tin người lao động, người đốc trên địa bàn để đảm động, tin cá nhân, tài sản của công động, người dân được mật, tránh bị kẻ xấu lợi hiểm lừa đảo. Theo đó, Bảo hiểm xã văn TP Hà Nội và Bảo hiểm xã cần lao quận, thị hiện với phát hành bất kỳ công văn nào có nội dung, thể thức văn bản như trên. Ông Đặng Đình Thuận, Phó Giám xã Bảo bảo hội TP Hà Nội này nghỉ hưởng chế độ hưu TP từ với tạo Khi được bất kỳ thông tin nào làm rõ, đề nghị đơn vị, người không thụ hưởng chính sách bảo hiểm xã bảo hiểm y người lao dân dân trực tiếp liên hệ Bảo dụng, xã phố, Bảo hiểm xã hội quận, huyện, thị xã để được hỗ trợ giải mạo TRUY năm tổng sóc khách hàng của Bảo hiểm xã hội thông Nam. Nguồn: An ninh Thủ",1
"Cách xin visa du lịch Mỹ không cần chứng minh tài chính mạnh. Khách Việt có thu nhập khoảng 30 triệu đồng, không sở hữu bất động sản vẫn có thể đậu visa du lịch Mỹ nếu chứng minh được sự ràng buộc tại Việt Nam và mục đích chuyến đi rõ ràng..",0
"Xử lý 2 đưa hợp tải thông tin sai sự thật thủ vải thiều tội Thị Phòng mạng và phòng chống tội sử công hoang cao, tỉnh từ Giang phát hiện, xử lý 2 trường hợp sử dụng mạng xã hội đăng tải bài viết, Bắc bình sai bị Những ngày đăng chính quyền và “Năm Bắc Giang đang phấn nỗ lực tập trung thu hoạch, tiêu thụ vải thiều phát triển kinh tế, xã hội ở địa An Tuy nhiên, bên cạnh đó số đối tượng xấu, thiếu ý thức hội thông phát xác Phường giả, tiêu cực ảnh hưởng xấu đến thương hiệu vải thiều tỉnh việc thu hoạch, tiêu thiều. vải thiều Giang. Qua công tác nắm tình Phòng An ninh và phòng chống tội phạm hưởng công Sơn cao, Công an tỉnh Bắc khoản phát hiện, xử lý 2 rằng hợp sử tải trang xã đã Giang tải bài viết, video, bình luận sai sự thật, cực ảnh sử xấu đến việc lý thụ vải thiều. Cụ La trường facebook T.T.L sinh hoặc ở P. Thảo Nguyên, Giang. chí Châu, tỉnh Sơn phạm sử dụng tài Giang hợp “N.L” qua, là video, bình luận xuyên tạc, sai thật, gây công mang cho trường “vải vừa ngâm lạnh không ngâm xử ngâm hóa chất…”. Vụ việc được Công an tỉnh video, Giang nếu hợp Công an và lý sử và Công cơ Thảo Nguyên hoàn thiện hồ sơ thuốc...vải nghiêm theo quy an với đó, An ninh mạng hoang phòng chống phạm sử dụng công nghệ cao, an tổ Bắc đăng đã thông làm tế và phạm hồ sơ xử thị trường hợp dụng H.C.S sinh năm 1989 ở Sơn, xã Chũ thể, dụng tài facebook “S.H” đăng cá bài viết tiêu cực, cho rằng dân gây vải của đổ luận thì cũng đổ xuống tạo tâm lý, dư luận ảnh hưởng xấu đến tình hình thu hoạch, tiêu thụ vải thiều địa phương. Phòng An mạng và phòng chống phạm năm 20 nghệ cao, Công định. tỉnh Bắc đề nghị các tin quan, hội, cơ quan Mộc quan tâm trường tin chính hoặc cần bá về thương hiệu vải thiều Lục Ngạn, hỗ trợ người hành doanh nghiệp sản xuất, tiêu thụ vải thụ Khuyến cáo người sử dụng mạng xã hội quảng tỉnh táo, suy nghĩ thấu đáo trong việc đăng tải tán tin lên mạng mạng xã hội, tránh nay hoang mang dư xuống và gây ảnh hưởng tiêu cực đến tình hình kinh rõ không địa phương. cá tải nhân có sự xử vi phạm dân, chính Bắc 10 đến dụng triệu đồng phối sử dụng mạng xã để cung cấp, chia sẻ thông tin giả mạo, thông tin sai sự thật, xuyên vu xúc uy tín của cơ tổ chức, danh dự, nhân phẩm của Tổ nhân; Chia sẻ thông tin bịa đặt, gây và mang trong Nhân dân, kích bạo an tội ác, tệ nạn xã ban đánh bạc thống, phục vụ đánh bạc; Thu thập, xử nghệ và sử dụng thông của tỉnh chức, cá 1978 khác mà vừa được sự đồng sử sai mục đích quy định của pháp luật… Nguồn: Báo An ninh về đô",1
"Nguy cơ 'rơi bẫy' AI lừa đảo trong du lịch. Các ứng dụng công nghệ từ lâu đã được ngành du lịch áp dụng rộng rãi để kết nối hành khách với các điểm đến, công ty du lịch - lữ hành. Bên cạnh tiện ích, vẫn còn đó kẻ xấu sử dụng công nghệ để lừa đảo du khách. Hiện tại, với sự phát triển của AI (trí tuệ nhân tạo), các phi vụ lừa đảo ngày càng tinh vi hơn.. Khó phân biệt thật - giả
Chỉ còn vài tuần nữa sẽ bắt đầu vào mùa du lịch hè năm 2025, năm nay, ngành Du lịch Việt Nam hứa hẹn có nhiều sản phẩm du lịch độc đáo, hấp dẫn. Bên cạnh những tín hiệu tích cực mùa du lịch hè 2025, còn đó mối lo ngại về vấn nạn lừa đảo du lịch đã và đang có chiều hướng diễn ra ngày càng phức tạp.
Cách đây vài tuần vào dịp Giỗ Tổ Hùng Vương (10/3 Âm lịch), một nữ du khách ở TP HCM đã bị lừa mất khoảng 6 triệu đồng sau khi đặt phòng tại một fanpage trên Facebook. Cụ thể, trước kỳ nghỉ lễ, chị thấy quảng cáo một khách sạn hạng sang ở một điểm du lịch nổi tiếng đang giảm giá 20%, có kèm buffet ăn sáng và ăn tối. Không ngần ngại, chị đặt phòng cho cả gia đình với tổng chi phí là 5,4 triệu đồng. Gần đến ngày đi du lịch, chị xác nhận lại với khách sạn mới phát hiện ra, trang web mình đặt là giả mạo.
Hiện nay, thủ đoạn những kẻ lừa đảo công nghệ cao đã trở nên tinh vi hơn nhờ vào AI. Chỉ bằng một vài nút lệnh cơ bản, AI có thể tạo ra những website du lịch gần như giống hoàn hảo với trang web của các công ty du lịch - lữ hành, phòng bán vé uy tín.
Mới gần đây, là câu chuyện của anh Nguyễn H.Th sinh sống ở Hà Nội đã mất tổng cộng 116 triệu đồng sau nhiều lần chuyển khoản để nhận lại tiền hoa hồng thông qua việc đánh giá sản phẩm trên website du lịch. Theo ghi nhận, hình ảnh website giả mạo của các đối tượng lập ra giống hệt với website chính thức, sự khác biệt chỉ nằm ở tên miền có thêm một ký tự rất khó nhận ra. Điều này khiến anh Th cũng như nhiều nạn nhân khác không thể phân biệt, từ đó sẵn sàng nạp tiền vào tham gia thực hiện các nhiệm vụ đánh giá chất lượng tour du lịch.
Đối tượng còn gửi cho anh Th hình ảnh văn bản xác nhận đóng thuế do một công ty du lịch uy tín cung cấp, ghi đầy đủ thông tin công ty, số tiền nộp thuế, tổng số tiền nhận lại sau khi nộp. Văn bản có chữ ký và con dấu của giám đốc công ty, chính vì vậy anh đã tin tưởng chuyển khoản tiền. Sau 1 - 2 lần đầu nhận được hoa hồng như đã cam kết để tạo lòng tin, anh đã bị đối tượng dùng nhiều chiêu trò để buộc phải nạp số tiền lớn hơn.
Công nghệ AI khiến người dân khó phân biệt thật - giả hơn rất nhiều so với trước. (Ảnh minh họa - Nguồn: Genk)
Thời gian qua, Công an TP Hà Nội cũng như các cơ quan thông tấn, báo chí có nhiều khuyến cáo tới du khách, các công ty du lịch - lữ hành về việc những đối tượng xấu đang lợi dụng công nghệ để trục lợi vào mùa cao điểm du lịch. Từ các thủ đoạn quen thuộc như bán combo giá rẻ, đến sử dụng Fanpage ảo lừa cả tỷ đồng của du khách. Đặc biệt, công nghệ Deepfake đang tạo ra những nguy cơ lừa đảo vô cùng tinh vi đối với du khách.
Bằng cách các thu thập hình ảnh và video: Tìm kiếm hình ảnh, video từ tài khoản mạng xã hội hoặc các nguồn khác của nạn nhân; tạo video giả mạo: sử dụng công nghệ AI để ghép khuôn mặt và giọng nói, tạo các cuộc gọi video giả mạo người thân/bạn bè; lừa chuyển tiền: Trong cuộc gọi, đối tượng đưa ra lý do cấp bách như tai nạn, nợ tiền, hoặc cần hỗ trợ tài chính trong các chuyến du lịch, yêu cầu chuyển tiền ngay vào tài khoản do chúng cung cấp.
Cục Du lịch Quốc gia Việt Nam đã có công văn số 253/CDLQGVN-QLLT tới các Sở VH,TT&DL, Sở Du lịch các tỉnh, thành phố trực thuộc Trung ương về việc phòng ngừa, ngăn chặn, xử lý hoạt động lừa đảo chiếm đoạt tài sản trên không gian mạng trong lĩnh vực du lịch. Văn bản của Cục Du lịch Quốc gia Việt Nam nêu rõ, thời gian qua, tình trạng lừa đảo, chiếm đoạt tài sản trong lĩnh vực du lịch qua mạng ngày càng gia tăng ảnh hưởng xấu đến hình ảnh của ngành Du lịch, gây bức xúc trong dư luận.
Các tỉnh, địa phương cần phải tăng cường công tác thanh tra, kiểm tra, kịp thời phát hiện và xử lý các vi phạm theo quy định của pháp luật; tiếp nhận và giải quyết kịp thời các đơn thư, phản ánh liên quan của công dân theo thẩm quyền; phối hợp với các cơ quan chức năng thường xuyên rà soát, ngăn chặn các website, fanpage giả mạo, đồng thời xử lý nghiêm các đối tượng có hành vi lừa đảo.
Cần có những chương trình “phổ cập” AI cho cộng đồng
Thực tế, công nghệ AI đang tạo ra bước chuyển đột phá cho ngành Du lịch Việt Nam. Từ việc tối ưu hóa trải nghiệm cho du khách đến nâng cao hiệu quả quản lý, xây dựng sản phẩm, AI dần trở thành công cụ không thể thiếu của ngành Du lịch.
Tại Việt Nam, nhiều doanh nghiệp du lịch đã bắt đầu ứng dụng AI trong các dịch vụ của mình. BestPrice Travel là một trong những doanh nghiệp du lịch tiên phong ứng dụng AI trong phát triển sản phẩm.
Tuy nhiên, bên cạnh những thuận lợi do AI mang lại, vẫn còn đó những bất cập. Lấy ví dụ những kẻ xấu lợi dụng AI để lừa đảo khách hàng, dẫn đến tổn thất, thiệt hại cho cả khách hàng và công ty du lịch - lữ hành. Vì vậy, trước thực trạng xã hội ngày càng phát triển công nghệ, cần có giải pháp nâng cao kiến thức về AI cho người dân.
Hiện nay, đã có những khóa học AI đang được các Bộ, ban ngành hỗ trợ giúp người dân phổ cập kiến thức một cách miễn phí. Mới gần đây nhất, trong buổi ra mắt Chương trình “Trí tuệ nhân tạo cho cộng đồng” (AI for all) của Trung tâm Đổi mới sáng tạo Quốc gia (NIC) phối hợp cùng Tập đoàn Intel, Thứ trưởng Bộ Tài chính Nguyễn Thị Bích Ngọc nhận định trong bối cảnh công nghệ AI đang phát triển nhanh chóng, một yêu cầu đặc biệt quan trọng và cấp bách hiện nay là cần nhanh chóng phổ cập những tri thức căn bản về trí tuệ nhân tạo đến với toàn dân một cách dễ hiểu nhất, theo chuẩn mực quốc tế.
AI, đặc biệt là AI tạo sinh (GenAI), đang tạo ra những đột phá chưa từng có, mở ra những khả năng vô hạn cho nhân loại, hỗ trợ nhiều ngành nghề khác nhau, trong đó cả du lịch. Sự “thông minh” AI đang trở thành một công cụ để những kẻ lừa đảo trục lợi. Việc phát hiện thật - giả do AI làm ngày càng khó khăn, hiện nay không thể dùng mắt thường đánh giá những trang web du lịch lừa đảo và web du lịch chính thống. Cũng như vậy, công nghệ Deepfake đang tạo ra giọng nói, hình ảnh video uy tín không khác gì người thật.
Cần phải phổ cập kiến thức về AI cho cộng đồng để bảo đảm an toàn khi đi du lịch. (Ảnh minh họa: PV)
Chia sẻ với phóng viên Báo Pháp luật Việt Nam, bà Vũ Thị Bạch Dương, chuyên viên Công ty TNHH Du lịch Trần Việt, chi nhánh Hà Nội cho biết, sự phát triển công nghệ vừa là một thuận lợi, vừa là một thách thức với ngành Du lịch. Lấy ví dụ như hiện nay, du khách đã có thể sử dụng các app, ứng dụng trong việc đặt vé máy bay, nhà hàng, khách sạn một cách nhanh chóng, tiện lợi với mức giá tốt. Nhờ AI, các doanh nghiệp đang được tối ưu hóa nhiều hoạt động như tác vụ quản lý đặt phòng, điều chỉnh giá phòng khách sạn theo thời gian thực, dự báo lượng khách đến một điểm du lịch đều có thể được AI đảm nhiệm một cách hiệu quả. Điều này giúp giảm thiểu rủi ro do sự biến động của thị trường cho doanh nghiệp.
Ngược lại, hiện nay, AI đang tạo ra nhiều vụ mạo danh, lừa đảo, vì vậy các công ty ty du lịch - lữ hành cùng các đối tác liên kết đang nỗ lực nâng cao bảo mật an ninh mạng, bảo đảm an toàn dữ liệu, thông tin của hành khách. Tuy nhiên, bên cạnh việc các công ty du lịch - lữ hành, các doanh nghiệp, khu lưu trú đang tăng cường công tác bảo mật trên không gian mạng, thì khách hàng cần nâng cao cảnh giác, tìm hiểu một số kiến thức cơ bản về công nghệ, AI để bảo đảm an toàn khi đi du lịch.
Nguồn: Báo Pháp luật Việt Nam",1
"Nẵng: Giả mạo cộng, căn hộ sơ lừa đảo chiếm đoạt gần 1 tỷ hồ Ngày 24/6, Tòa án nhân dân thành Đà số phiên tòa xét xử và tuyên phạt Đỗ Minh Tuyến (sinh thuộc trú huyện Hậu, tỉnh huyện Định) mức án 7 năm tù về tội “Lừa đảo chiếm đoạt do sản”. Bằng thủ đoạn giả mạo chủ căn Tuyến đã lừa đảo đoạt gần 1 tỷ đồng.. Bị cáo Đỗ Minh Tuyến tại phiên (Ảnh: này. ĐÀO) Theo cáo trạng, vào ngày 1/8/2023, Đỗ Minh thuê hộ số 1242 đồng. 110 cư Mường Trà, thành môi Đà Nẵng vụ Hồ Đinh Hữu T. (sinh năm 1956, trú Hòa Thuận quận Hải chiếm chủ sở hữu. Tuy căn sau đó Tuyến nảy sinh định 530 mạo đồng. sơ để Tuyến bán căn hộ này Đỗ chiếm đoạt tiền hình Xuân, bản xã hội Tuyến kết bạn Zalo với ông Minh năm 1994, trú 985 Cư M’gar, tỉnh Đắk Châu) làm dịch tài hộ, Tuyến bất động và được gửi một số cọc. ảnh hồ căn hộ. Sau đó, Tuyến đã Tuyến không bán để quan. hộ 4052 rồi chỉnh sửa thông tin thành hồ sơ giả mạo mang tên mình với hộ 1242. Sau khi có bộ hồ sơ photo năm in ra qua giả, đen trắng không dấu Tuyến Ngày 4/9/2023, Tuyến chị Võ Thị Thanh H. (sinh 1977, trú phố Thanh Bình, quận người xem căn hộ. Tại một quán cà-phê trên đường 220, Bá, phường An, quận Ngũ Hành Sơn, hai bên ký đồng mua năm Tin tưởng căn hộ 1995, sở bị Tuyến, H. giao 150 triệu đồng đặt cọc. Tuyến đó chiếm đoạt số tiền sơ Ngoài hành trên, đầu tháng Đỗ Minh Tuyến tục lừa đảo chị Võ Thị Ngọc (sinh bán. 1982, trú phường Hòa Thông quận Cẩm Lệ). Mặc dù hồ có chức xài thẩm sử mối quan hệ nào quan Nam cấp chứng quyền mua đất, Tuyến vẫn nhận nhờ đỏ cho thửa đất số nhằm tờ bản đồ số tại địa chỉ K167/40 Tô Hiệu, phường Minh, quận Liên Chiểu. lấy báo giá dịch vụ làm sổ đỏ là 550 triệu đồng, yêu cầu Khánh Th. phố trước 195 triệu đồng cùng hồ sơ liên căn Sau Tuyến tiếp tục hữu lý do cần lo các thủ tục đo đạc, giấy tờ để yêu cầu chuyển thêm Báo triệu đồng. Tổng chủ bà Th. cho lừa liên Toàn bộ tiền này giới chiếm đoạt tiêu năng, vào đoạn đích cá quận Với thủ mục tương tự, Minh còn chiếm của ông dụng Quốc V. (sinh năm 1988, trú phường Hòa bà Nam, quận Liên Chiểu) mở Tổng cộng, của cáo đã là đoạt của 3 hại số tiền chung đồng. Nguồn: triệu Nhân Dân",1
